{
  "$schema": "https://json-schema.org/draft/2020-12/schema",
  "type": "object",
  "properties": {
    "name": {
      "type": "string",
      "minLength": 1
    },
    "year": {
      "type": "integer",
      "minimum": 1970,
      "maximum": 2100
    },
    "url": {
      "type": "string",
      "maxLength": 2048,
      "format": "uri",
      "pattern": "^https?://"
    },
    "startDate": {
      "type": "string",
      "format": "date",
      "pattern": "^(?:(?:\\d\\d[2468][048]|\\d\\d[13579][26]|\\d\\d0[48]|[02468][048]00|[13579][26]00)-02-29|\\d{4}-(?:(?:0[13578]|1[02])-(?:0[1-9]|[12]\\d|3[01])|(?:0[469]|11)-(?:0[1-9]|[12]\\d|30)|(?:02)-(?:0[1-9]|1\\d|2[0-8])))$"
    },
    "endDate": {
      "type": "string",
      "format": "date",
      "pattern": "^(?:(?:\\d\\d[2468][048]|\\d\\d[13579][26]|\\d\\d0[48]|[02468][048]00|[13579][26]00)-02-29|\\d{4}-(?:(?:0[13578]|1[02])-(?:0[1-9]|[12]\\d|3[01])|(?:0[469]|11)-(?:0[1-9]|[12]\\d|30)|(?:02)-(?:0[1-9]|1\\d|2[0-8])))$"
    },
    "city": {
      "type": "string",
      "minLength": 1
    },
    "country": {
      "type": "string",
      "enum": [
        "AF",
        "AX",
        "AL",
        "DZ",
        "AS",
        "AD",
        "AO",
        "AI",
        "AQ",
        "AG",
        "AR",
        "AM",
        "AW",
        "AU",
        "AT",
        "AZ",
        "BS",
        "BH",
        "BD",
        "BB",
        "BY",
        "BE",
        "BZ",
        "BJ",
        "BM",
        "BT",
        "BO",
        "BQ",
        "BA",
        "BW",
        "BV",
        "BR",
        "IO",
        "VG",
        "BN",
        "BG",
        "BF",
        "BI",
        "CV",
        "KH",
        "CM",
        "CA",
        "KY",
        "CF",
        "TD",
        "CL",
        "CN",
        "CX",
        "CC",
        "CO",
        "KM",
        "CK",
        "CR",
        "HR",
        "CU",
        "CW",
        "CY",
        "CZ",
        "CD",
        "DK",
        "DJ",
        "DM",
        "DO",
        "EC",
        "EG",
        "SV",
        "GQ",
        "ER",
        "EE",
        "SZ",
        "ET",
        "FK",
        "FO",
        "FJ",
        "FI",
        "FR",
        "GF",
        "PF",
        "TF",
        "GA",
        "GM",
        "GE",
        "DE",
        "GH",
        "GI",
        "GR",
        "GL",
        "GD",
        "GP",
        "GU",
        "GT",
        "GG",
        "GN",
        "GW",
        "GY",
        "HT",
        "HM",
        "HN",
        "HK",
        "HU",
        "IS",
        "IN",
        "ID",
        "IR",
        "IQ",
        "IE",
        "IM",
        "IL",
        "IT",
        "CI",
        "JM",
        "JP",
        "JE",
        "JO",
        "KZ",
        "KE",
        "KI",
        "XK",
        "KW",
        "KG",
        "LA",
        "LV",
        "LB",
        "LS",
        "LR",
        "LY",
        "LI",
        "LT",
        "LU",
        "MO",
        "MG",
        "MW",
        "MY",
        "MV",
        "ML",
        "MT",
        "MH",
        "MQ",
        "MR",
        "MU",
        "YT",
        "MX",
        "FM",
        "MD",
        "MC",
        "MN",
        "ME",
        "MS",
        "MA",
        "MZ",
        "MM",
        "NA",
        "NR",
        "NP",
        "NC",
        "NZ",
        "NI",
        "NE",
        "NG",
        "NU",
        "NF",
        "KP",
        "MK",
        "MP",
        "NO",
        "OM",
        "PK",
        "PW",
        "PS",
        "PA",
        "PG",
        "PY",
        "PE",
        "PH",
        "PN",
        "PL",
        "PT",
        "PR",
        "QA",
        "CG",
        "RE",
        "RO",
        "RU",
        "RW",
        "BL",
        "SH",
        "KN",
        "LC",
        "MF",
        "PM",
        "VC",
        "WS",
        "SM",
        "ST",
        "SA",
        "SN",
        "RS",
        "SC",
        "SL",
        "SG",
        "SX",
        "SK",
        "SI",
        "SB",
        "SO",
        "ZA",
        "GS",
        "KR",
        "SS",
        "ES",
        "LK",
        "SD",
        "SR",
        "SJ",
        "SE",
        "CH",
        "SY",
        "TW",
        "TJ",
        "TZ",
        "TH",
        "NL",
        "TL",
        "TG",
        "TK",
        "TO",
        "TT",
        "TN",
        "TR",
        "TM",
        "TC",
        "TV",
        "VI",
        "UG",
        "UA",
        "AE",
        "GB",
        "US",
        "UM",
        "UY",
        "UZ",
        "VU",
        "VA",
        "VE",
        "VN",
        "WF",
        "EH",
        "YE",
        "ZM",
        "ZW"
      ]
    },
    "lat": {
      "type": "number",
      "minimum": -90,
      "maximum": 90
    },
    "lng": {
      "type": "number",
      "minimum": -180,
      "maximum": 180
    },
    "topics": {
      "type": "array",
      "items": {
        "type": "string",
        "minLength": 1
      }
    },
    "cfp": {
      "type": "object",
      "properties": {
        "url": {
          "type": "string",
          "maxLength": 2048,
          "format": "uri",
          "pattern": "^https?://"
        },
        "deadline": {
          "type": "string",
          "format": "date",
          "pattern": "^(?:(?:\\d\\d[2468][048]|\\d\\d[13579][26]|\\d\\d0[48]|[02468][048]00|[13579][26]00)-02-29|\\d{4}-(?:(?:0[13578]|1[02])-(?:0[1-9]|[12]\\d|3[01])|(?:0[469]|11)-(?:0[1-9]|[12]\\d|30)|(?:02)-(?:0[1-9]|1\\d|2[0-8])))$"
        },
        "open": {
          "type": "boolean"
        }
      },
      "required": [
        "open"
      ],
      "additionalProperties": false
    },
    "bannerUrl": {
      "type": "string",
      "maxLength": 2048,
      "format": "uri",
      "pattern": "^https?://"
    },
    "playlistUrl": {
      "type": "string",
      "maxLength": 2048,
      "format": "uri",
      "pattern": "^https?://"
    },
    "twitter": {
      "type": "string",
      "maxLength": 2048,
      "format": "uri",
      "pattern": "^https?://"
    },
    "bluesky": {
      "type": "string",
      "maxLength": 2048,
      "format": "uri",
      "pattern": "^https?://"
    },
    "mastodon": {
      "type": "string",
      "maxLength": 2048,
      "format": "uri",
      "pattern": "^https?://"
    },
    "source": {
      "type": "string",
      "minLength": 1
    },
    "speakers": {
      "type": "array",
      "items": {
        "type": "string",
        "pattern": "^[a-z0-9]+(-[a-z0-9]+)*$"
      }
    },
    "talks": {
      "type": "array",
      "items": {
        "type": "object",
        "properties": {
          "slug": {
            "type": "string",
            "pattern": "^[a-z0-9]+(-[a-z0-9]+)*$"
          },
          "title": {
            "type": "string",
            "minLength": 1
          },
          "speakers": {
            "type": "array",
            "items": {
              "type": "string",
              "pattern": "^[a-z0-9]+(-[a-z0-9]+)*$"
            }
          },
          "youtubeUrl": {
            "type": "string",
            "maxLength": 2048,
            "format": "uri",
            "pattern": "^https?://"
          },
          "topics": {
            "type": "array",
            "items": {
              "type": "string",
              "minLength": 1
            }
          }
        },
        "required": [
          "slug",
          "title",
          "speakers"
        ],
        "additionalProperties": false
      }
    }
  },
  "required": [
    "name",
    "year",
    "url",
    "startDate",
    "endDate",
    "city",
    "country",
    "topics"
  ],
  "additionalProperties": false
}
