{
  "name": "CTO Craft Con: London 2026",
  "year": 2026,
  "url": "https://conference.ctocraft.com/london-2026",
  "startDate": "2026-03-10",
  "endDate": "2026-03-11",
  "city": "London",
  "country": "GB",
  "lat": 51.50853,
  "lng": -0.12574,
  "topics": [
    "Networking"
  ],
  "cfp": {
    "url": "http://conference.ctocraft.com/london-2026/call-for-content",
    "deadline": "2025-07-18",
    "open": false
  },
  "source": "confs.tech"
}
