{
  "name": "Devopsdays Zurich 2024",
  "year": 2024,
  "url": "https://devopsdays.org/events/2024-zurich/welcome",
  "startDate": "2024-04-16",
  "endDate": "2024-04-17",
  "city": "Zurich",
  "country": "CH",
  "lat": 47.36667,
  "lng": 8.55,
  "topics": [
    "DevOps"
  ],
  "source": "confs.tech"
}
