{
  "name": "SmashingConf 2020",
  "year": 2020,
  "url": "https://smashingconf.com/sf-2020",
  "startDate": "2020-11-10",
  "endDate": "2020-11-11",
  "city": "San Francisco, CA",
  "country": "US",
  "lat": 37.77493,
  "lng": -122.41942,
  "topics": [
    "CSS",
    "JavaScript",
    "Design/UX"
  ],
  "twitter": "https://x.com/SmashingConf",
  "source": "confs.tech"
}
