{
  "name": "Artificial Intelligence for Geological Modelling and Mapping 2024",
  "year": 2024,
  "url": "https://www.eventbrite.co.uk/e/artificial-intelligence-for-geological-modelling-and-mapping-tickets-749228040237",
  "startDate": "2024-06-22",
  "endDate": "2024-06-23",
  "city": "Exeter",
  "country": "GB",
  "lat": 50.7236,
  "lng": -3.52751,
  "topics": [
    "Data/AI"
  ],
  "source": "confs.tech"
}
