{
  "name": "Amplify 2024",
  "year": 2024,
  "url": "https://amplify.abstracta.us",
  "startDate": "2024-08-19",
  "endDate": "2024-08-21",
  "city": "Tulsa, OK",
  "country": "US",
  "lat": 36.15398,
  "lng": -95.99277,
  "topics": [],
  "cfp": {
    "url": "https://forms.gle/CzJnAWkToPwBkt5Y9",
    "deadline": "2024-06-15",
    "open": false
  },
  "source": "confs.tech"
}
