{
  "name": "DevOps Conference London 2023",
  "year": 2023,
  "url": "https://devopscon.io/london",
  "startDate": "2023-04-24",
  "endDate": "2023-04-27",
  "city": "London",
  "country": "GB",
  "lat": 51.50853,
  "lng": -0.12574,
  "topics": [
    "DevOps",
    "Performance",
    "Security"
  ],
  "twitter": "https://x.com/devops_con",
  "source": "confs.tech"
}
