{
  "name": "VOICE & AI 2023",
  "year": 2023,
  "url": "https://www.voiceand.ai",
  "startDate": "2023-09-05",
  "endDate": "2023-09-07",
  "city": "Washington, DC",
  "country": "US",
  "lat": 38.89511,
  "lng": -77.03637,
  "topics": [
    "APIs",
    "Data/AI",
    "Networking"
  ],
  "twitter": "https://x.com/VOICEandAI",
  "source": "confs.tech"
}
