{
  "name": "Build Stuff 2019",
  "year": 2019,
  "url": "https://www.ukraine.buildstuff.events",
  "startDate": "2019-11-18",
  "endDate": "2019-11-20",
  "city": "Kyiv",
  "country": "UA",
  "lat": 50.45466,
  "lng": 30.5238,
  "topics": [],
  "twitter": "https://x.com/Buildstuffua",
  "source": "confs.tech"
}
