{
  "name": "SOSS Policy Summit 2024",
  "year": 2024,
  "url": "https://events.linuxfoundation.org/soss-policy-summit-dc",
  "startDate": "2024-09-09",
  "endDate": "2024-09-09",
  "city": "Washington, DC",
  "country": "US",
  "lat": 38.89511,
  "lng": -77.03637,
  "topics": [
    "Security"
  ],
  "twitter": "https://x.com/openssf",
  "source": "confs.tech"
}
