{
  "name": "JavaZone 2022",
  "year": 2022,
  "url": "https://2022.javazone.no",
  "startDate": "2022-09-07",
  "endDate": "2022-09-08",
  "city": "Oslo",
  "country": "NO",
  "lat": 59.91273,
  "lng": 10.74609,
  "topics": [
    "Java"
  ],
  "cfp": {
    "url": "https://2022.javazone.no/#/speakers",
    "deadline": "2022-04-30",
    "open": false
  },
  "twitter": "https://x.com/javazone",
  "source": "confs.tech"
}
